{"artifact_version":"0.2.2","builds":[{"backend":"webgpu","catalog_hash":"sha256:31f77e005f480c9714cd0ee85c589d0ee5b445aeae90ad646ae1ca2662764059","default_variant":"raw","input_kinds":["render-package"],"level":"B","path":"embed/web-basic-webgpu","product":"embed","profile":"web-basic-webgpu","protocol_version":1,"render_package_version":{"major":1,"minor":3},"requires":{"secure_context":true,"webgpu":{"features":[],"limits":{}},"worker":false},"variants":[{"encoding":"raw","entry":"viewer.mjs","files":{"client.mjs":{"decoded":{"bytes":4419,"sha256":"cf86cd62f4dec12f0adc61f0f3ff19ed56448c74906e7949b0d9414af6a94065"},"path":"client.mjs","stored":{"bytes":4419,"sha256":"cf86cd62f4dec12f0adc61f0f3ff19ed56448c74906e7949b0d9414af6a94065"}},"generated/web-basic-webgpu/catalog.json":{"decoded":{"bytes":190318,"sha256":"2865fd1a94e432fd523e0cdd7cf0c4d9eff2d0558bd66ac1125df8f31f3492d3"},"path":"generated/web-basic-webgpu/catalog.json","stored":{"bytes":190318,"sha256":"2865fd1a94e432fd523e0cdd7cf0c4d9eff2d0558bd66ac1125df8f31f3492d3"}},"generated/web-basic-webgpu/catalog.sha256":{"decoded":{"bytes":72,"sha256":"409fd192626ef36d27c8afbf29fd992df98ea5d3f467234e3c050ea027952032"},"path":"generated/web-basic-webgpu/catalog.sha256","stored":{"bytes":72,"sha256":"409fd192626ef36d27c8afbf29fd992df98ea5d3f467234e3c050ea027952032"}},"generated/web-basic-webgpu/client.d.ts":{"decoded":{"bytes":49906,"sha256":"b2ffad1215377587cfd3e7a90274ee944889c281792df8d56bcf65dbd7a0c735"},"path":"generated/web-basic-webgpu/client.d.ts","stored":{"bytes":49906,"sha256":"b2ffad1215377587cfd3e7a90274ee944889c281792df8d56bcf65dbd7a0c735"}},"generated/web-basic-webgpu/custom-elements.json":{"decoded":{"bytes":6211,"sha256":"270a43689bf0a063b77534e39ce9b22e14c682180b9457c5a42cc78f40849d7a"},"path":"generated/web-basic-webgpu/custom-elements.json","stored":{"bytes":6211,"sha256":"270a43689bf0a063b77534e39ce9b22e14c682180b9457c5a42cc78f40849d7a"}},"generated/web-basic-webgpu/element.d.ts":{"decoded":{"bytes":3223,"sha256":"1a84d2ffe38e6d9e699f9eb58869d31c8281b30976b64f64f94dcdf3a0d2e208"},"path":"generated/web-basic-webgpu/element.d.ts","stored":{"bytes":3223,"sha256":"1a84d2ffe38e6d9e699f9eb58869d31c8281b30976b64f64f94dcdf3a0d2e208"}},"generated/web-basic-webgpu/element.json":{"decoded":{"bytes":4109,"sha256":"398a2f6e6557c94e91cc86017d9e28806dfc6dd41728d021334deddf12110902"},"path":"generated/web-basic-webgpu/element.json","stored":{"bytes":4109,"sha256":"398a2f6e6557c94e91cc86017d9e28806dfc6dd41728d021334deddf12110902"}},"renderer-webgpu.wasm":{"decoded":{"bytes":39115817,"sha256":"635627a9370e4497b7b4eab3b63021c6e01624c62614ea1718a3bc6db7e60983"},"path":"renderer-webgpu.wasm","stored":{"bytes":39115817,"sha256":"635627a9370e4497b7b4eab3b63021c6e01624c62614ea1718a3bc6db7e60983"}},"renderer_webgpu.js":{"decoded":{"bytes":97503,"sha256":"7423b0f0e6533a9f2cf7e462185183bea27b700ed3a79f799fdfca9a8ee1a20a"},"path":"renderer_webgpu.js","stored":{"bytes":97503,"sha256":"7423b0f0e6533a9f2cf7e462185183bea27b700ed3a79f799fdfca9a8ee1a20a"}},"viewer.mjs":{"decoded":{"bytes":67516,"sha256":"dc094f0815be0af3a1b3d9b9cade5eda8ae646b151cfbc467e4807bfa7f54b6f"},"path":"viewer.mjs","stored":{"bytes":67516,"sha256":"dc094f0815be0af3a1b3d9b9cade5eda8ae646b151cfbc467e4807bfa7f54b6f"}}},"id":"raw","manifest":{"bytes":1579,"sha256":"ff5f363d07d84feeb019d4b80b2b1e083ec7ee614b0f6acf17a8bb6e04d7fb98"},"path":"embed/web-basic-webgpu","requires":{"wasm":true},"runtime":"wasm","transfer":{"catalog_features":["Events","basic_models","controls","diagnostics.graphics"],"files":{"client.mjs":{"brotli_11":1178,"gzip_9":1394,"raw":4419,"stripped":4419},"generated/web-basic-webgpu/catalog.json":{"brotli_11":15265,"gzip_9":20381,"raw":190318,"stripped":190318},"generated/web-basic-webgpu/catalog.sha256":{"brotli_11":64,"gzip_9":80,"raw":72,"stripped":72},"generated/web-basic-webgpu/client.d.ts":{"brotli_11":7992,"gzip_9":9071,"raw":49906,"stripped":49906},"generated/web-basic-webgpu/custom-elements.json":{"brotli_11":1008,"gzip_9":1263,"raw":6211,"stripped":6211},"generated/web-basic-webgpu/element.d.ts":{"brotli_11":815,"gzip_9":942,"raw":3223,"stripped":3223},"generated/web-basic-webgpu/element.json":{"brotli_11":1190,"gzip_9":1435,"raw":4109,"stripped":4109},"renderer-webgpu.wasm":{"brotli_11":8422125,"gzip_9":13369450,"raw":39115817,"stripped":39115657},"renderer_webgpu.js":{"brotli_11":14105,"gzip_9":16710,"raw":97503,"stripped":97503},"viewer.mjs":{"brotli_11":13951,"gzip_9":16252,"raw":67516,"stripped":67516}},"linked_feature_graph":null,"provisional_budgets_enforced":false}}]},{"backend":"webgl2","catalog_hash":"sha256:2818f118bde98ff294b86e9c8c81af149ac430e2c228e8f69159884eff9e712e","default_variant":"raw","input_kinds":["render-package"],"level":"C","path":"embed/web-basic-webgl2","product":"embed","profile":"web-basic-webgl2","protocol_version":1,"render_package_version":{"major":1,"minor":3},"requires":{"secure_context":true,"webgl2":{"min_samples":4},"worker":false},"variants":[{"encoding":"raw","entry":"viewer.mjs","files":{"client.mjs":{"decoded":{"bytes":4419,"sha256":"cf86cd62f4dec12f0adc61f0f3ff19ed56448c74906e7949b0d9414af6a94065"},"path":"client.mjs","stored":{"bytes":4419,"sha256":"cf86cd62f4dec12f0adc61f0f3ff19ed56448c74906e7949b0d9414af6a94065"}},"generated/web-basic-webgl2/catalog.json":{"decoded":{"bytes":190318,"sha256":"9982692f7cc1b8bfbf2759b25c5cb095475ca29762c5bb2eca65fad714980ba8"},"path":"generated/web-basic-webgl2/catalog.json","stored":{"bytes":190318,"sha256":"9982692f7cc1b8bfbf2759b25c5cb095475ca29762c5bb2eca65fad714980ba8"}},"generated/web-basic-webgl2/catalog.sha256":{"decoded":{"bytes":72,"sha256":"0a6f5546b86b810cf00b4d61f198c6e60125e85b6eb28ca63323ffb3e41b9dc3"},"path":"generated/web-basic-webgl2/catalog.sha256","stored":{"bytes":72,"sha256":"0a6f5546b86b810cf00b4d61f198c6e60125e85b6eb28ca63323ffb3e41b9dc3"}},"generated/web-basic-webgl2/client.d.ts":{"decoded":{"bytes":49906,"sha256":"b2ffad1215377587cfd3e7a90274ee944889c281792df8d56bcf65dbd7a0c735"},"path":"generated/web-basic-webgl2/client.d.ts","stored":{"bytes":49906,"sha256":"b2ffad1215377587cfd3e7a90274ee944889c281792df8d56bcf65dbd7a0c735"}},"generated/web-basic-webgl2/custom-elements.json":{"decoded":{"bytes":6211,"sha256":"270a43689bf0a063b77534e39ce9b22e14c682180b9457c5a42cc78f40849d7a"},"path":"generated/web-basic-webgl2/custom-elements.json","stored":{"bytes":6211,"sha256":"270a43689bf0a063b77534e39ce9b22e14c682180b9457c5a42cc78f40849d7a"}},"generated/web-basic-webgl2/element.d.ts":{"decoded":{"bytes":3223,"sha256":"1a84d2ffe38e6d9e699f9eb58869d31c8281b30976b64f64f94dcdf3a0d2e208"},"path":"generated/web-basic-webgl2/element.d.ts","stored":{"bytes":3223,"sha256":"1a84d2ffe38e6d9e699f9eb58869d31c8281b30976b64f64f94dcdf3a0d2e208"}},"generated/web-basic-webgl2/element.json":{"decoded":{"bytes":4109,"sha256":"398a2f6e6557c94e91cc86017d9e28806dfc6dd41728d021334deddf12110902"},"path":"generated/web-basic-webgl2/element.json","stored":{"bytes":4109,"sha256":"398a2f6e6557c94e91cc86017d9e28806dfc6dd41728d021334deddf12110902"}},"renderer-webgl2.wasm":{"decoded":{"bytes":41674624,"sha256":"db1bbce7fd66fb53dfa70a54d9d80c04c1995e68827c4eae6f4ff6a3bee0982e"},"path":"renderer-webgl2.wasm","stored":{"bytes":41674624,"sha256":"db1bbce7fd66fb53dfa70a54d9d80c04c1995e68827c4eae6f4ff6a3bee0982e"}},"renderer_webgl2.js":{"decoded":{"bytes":89625,"sha256":"0bdcf76a9d3adbdefaf3abff04d825b95b5e47bbb42e34b302f610807208dd5f"},"path":"renderer_webgl2.js","stored":{"bytes":89625,"sha256":"0bdcf76a9d3adbdefaf3abff04d825b95b5e47bbb42e34b302f610807208dd5f"}},"viewer.mjs":{"decoded":{"bytes":67542,"sha256":"5e972099920f0052fbf820923174d352095cd1ff6965d8fb1057790bfe6f4fcc"},"path":"viewer.mjs","stored":{"bytes":67542,"sha256":"5e972099920f0052fbf820923174d352095cd1ff6965d8fb1057790bfe6f4fcc"}}},"id":"raw","manifest":{"bytes":1579,"sha256":"677644d54e0c0ef332467c4a813a8a817310c3040b36f7f4925568b8b1faa9d9"},"path":"embed/web-basic-webgl2","requires":{"wasm":true},"runtime":"wasm","transfer":{"catalog_features":["Events","basic_models","controls","diagnostics.graphics"],"files":{"client.mjs":{"brotli_11":1178,"gzip_9":1394,"raw":4419,"stripped":4419},"generated/web-basic-webgl2/catalog.json":{"brotli_11":15272,"gzip_9":20381,"raw":190318,"stripped":190318},"generated/web-basic-webgl2/catalog.sha256":{"brotli_11":62,"gzip_9":78,"raw":72,"stripped":72},"generated/web-basic-webgl2/client.d.ts":{"brotli_11":7992,"gzip_9":9071,"raw":49906,"stripped":49906},"generated/web-basic-webgl2/custom-elements.json":{"brotli_11":1008,"gzip_9":1263,"raw":6211,"stripped":6211},"generated/web-basic-webgl2/element.d.ts":{"brotli_11":815,"gzip_9":942,"raw":3223,"stripped":3223},"generated/web-basic-webgl2/element.json":{"brotli_11":1190,"gzip_9":1435,"raw":4109,"stripped":4109},"renderer-webgl2.wasm":{"brotli_11":9098164,"gzip_9":14370485,"raw":41674624,"stripped":41674464},"renderer_webgl2.js":{"brotli_11":11407,"gzip_9":13692,"raw":89625,"stripped":89625},"viewer.mjs":{"brotli_11":13961,"gzip_9":16264,"raw":67542,"stripped":67542}},"linked_feature_graph":null,"provisional_budgets_enforced":false}},{"encoding":"gzip","entry":"viewer.mjs","files":{"client.mjs":{"decoded":{"bytes":4419,"sha256":"cf86cd62f4dec12f0adc61f0f3ff19ed56448c74906e7949b0d9414af6a94065"},"path":"client.mjs","stored":{"bytes":4419,"sha256":"cf86cd62f4dec12f0adc61f0f3ff19ed56448c74906e7949b0d9414af6a94065"}},"generated/web-basic-webgl2/catalog.json":{"decoded":{"bytes":190318,"sha256":"9982692f7cc1b8bfbf2759b25c5cb095475ca29762c5bb2eca65fad714980ba8"},"path":"generated/web-basic-webgl2/catalog.json","stored":{"bytes":190318,"sha256":"9982692f7cc1b8bfbf2759b25c5cb095475ca29762c5bb2eca65fad714980ba8"}},"generated/web-basic-webgl2/catalog.sha256":{"decoded":{"bytes":72,"sha256":"0a6f5546b86b810cf00b4d61f198c6e60125e85b6eb28ca63323ffb3e41b9dc3"},"path":"generated/web-basic-webgl2/catalog.sha256","stored":{"bytes":72,"sha256":"0a6f5546b86b810cf00b4d61f198c6e60125e85b6eb28ca63